{
  "kind": "view",
  "name": "orders_customer",
  "combine": "join",
  "sources": [
    {
      "kind": "table",
      "name": "orders"
    },
    {
      "kind": "table",
      "name": "customer"
    }
  ],
  "joins": [
    {
      "left": "orders",
      "right": "customer",
      "type": "inner",
      "on": [
        {
          "left_column": "customer_id",
          "right_column": "customer_id"
        }
      ]
    }
  ],
  "columns": [
    {
      "name": "order_id",
      "mappings": [
        {
          "source": "orders",
          "column": "order_id"
        }
      ]
    },
    {
      "name": "customer_id",
      "mappings": [
        {
          "source": "orders",
          "column": "customer_id"
        },
        {
          "source": "customer",
          "column": "customer_id"
        }
      ]
    },
    {
      "name": "region_code",
      "mappings": [
        {
          "source": "orders",
          "column": "region_code"
        },
        {
          "source": "customer",
          "column": "region_code"
        }
      ]
    },
    {
      "name": "status_code",
      "mappings": [
        {
          "source": "orders",
          "column": "status_code"
        }
      ]
    },
    {
      "name": "customer_status_code",
      "mappings": [
        {
          "source": "customer",
          "column": "status_code"
        }
      ]
    },
    {
      "name": "order_date",
      "mappings": [
        {
          "source": "orders",
          "column": "order_date"
        }
      ]
    },
    {
      "name": "sale_amount",
      "mappings": [
        {
          "source": "orders",
          "column": "sale_amount"
        }
      ]
    },
    {
      "name": "fx_rate",
      "mappings": [
        {
          "source": "orders",
          "column": "fx_rate"
        }
      ]
    }
  ]
}
